{
  "$schema": "https://json-schema.org/draft/2020-12/schema",
  "$id": "https://make-harness.local/schemas/goal_contract.schema.json",
  "title": "Goal Contract",
  "description": "Concrete contract produced by goal_refiner before any worker execution.",
  "type": "object",
  "additionalProperties": false,
  "required": [
    "work_type",
    "raw_user_request",
    "concrete_goal",
    "success_criteria",
    "scope_in",
    "scope_out",
    "assumptions",
    "implementation_constraints",
    "quality_score_threshold",
    "scenario_flows",
    "completion_rubric",
    "verification_matrix",
    "acceptance_evidence_plan",
    "iteration_policy",
    "open_questions",
    "delegation_plan_seed"
  ],
  "properties": {
    "schema_version": {
      "type": "string",
      "default": "1.0.0"
    },
    "goal_id": {
      "type": "string",
      "minLength": 1
    },
    "work_type": {
      "enum": [
        "code_change",
        "docs",
        "schema_policy",
        "app_product",
        "research",
        "other"
      ]
    },
    "experience_kind": {
      "enum": [
        "app",
        "site",
        "tool",
        "web_game",
        "game",
        "other_product"
      ]
    },
    "raw_user_request": {
      "type": "string",
      "minLength": 1
    },
    "concrete_goal": {
      "type": "string",
      "minLength": 1
    },
    "success_criteria": {
      "$ref": "#/$defs/string_list_nonempty"
    },
    "scope_in": {
      "$ref": "#/$defs/string_list_nonempty"
    },
    "scope_out": {
      "$ref": "#/$defs/string_list"
    },
    "assumptions": {
      "$ref": "#/$defs/string_list"
    },
    "implementation_constraints": {
      "$ref": "#/$defs/string_list_nonempty"
    },
    "product_brief": {
      "$ref": "#/$defs/product_brief"
    },
    "app_quality_gates": {
      "$ref": "#/$defs/app_quality_gates"
    },
    "game_brief": {
      "$ref": "#/$defs/game_brief"
    },
    "quality_score_threshold": {
      "type": "integer",
      "minimum": 85,
      "maximum": 100,
      "default": 85
    },
    "scenario_flows": {
      "type": "array",
      "minItems": 1,
      "items": {
        "$ref": "#/$defs/scenario_flow"
      }
    },
    "completion_rubric": {
      "$ref": "#/$defs/completion_rubric"
    },
    "verification_matrix": {
      "$ref": "#/$defs/verification_matrix"
    },
    "acceptance_evidence_plan": {
      "$ref": "#/$defs/string_list_nonempty"
    },
    "iteration_policy": {
      "oneOf": [
        {
          "$ref": "#/$defs/string_list_nonempty"
        },
        {
          "$ref": "#/$defs/iteration_policy_object"
        }
      ]
    },
    "iteration_budget": {
      "$ref": "#/$defs/iteration_budget"
    },
    "security_policy": {
      "$ref": "#/$defs/security_policy"
    },
    "open_questions": {
      "$ref": "#/$defs/string_list"
    },
    "delegation_plan_seed": {
      "type": "array",
      "minItems": 1,
      "items": {
        "oneOf": [
          {
            "type": "string",
            "minLength": 1
          },
          {
            "$ref": "#/$defs/delegation_seed"
          }
        ]
      }
    }
  },
  "allOf": [
    {
      "if": {
        "properties": {
          "work_type": {
            "const": "app_product"
          }
        },
        "required": [
          "work_type"
        ]
      },
      "then": {
        "required": [
          "product_brief",
          "app_quality_gates"
        ]
      }
    }
  ],
  "$defs": {
    "string_list": {
      "type": "array",
      "items": {
        "type": "string",
        "minLength": 1
      }
    },
    "string_list_nonempty": {
      "type": "array",
      "minItems": 1,
      "items": {
        "type": "string",
        "minLength": 1
      }
    },
    "scenario_flow": {
      "type": "object",
      "additionalProperties": false,
      "required": [
        "id",
        "name",
        "actor",
        "preconditions",
        "steps",
        "expected_result",
        "failure_or_edge_cases"
      ],
      "properties": {
        "id": {
          "type": "string",
          "minLength": 1
        },
        "name": {
          "type": "string",
          "minLength": 1
        },
        "actor": {
          "type": "string",
          "minLength": 1
        },
        "preconditions": {
          "$ref": "#/$defs/string_list"
        },
        "steps": {
          "$ref": "#/$defs/string_list_nonempty"
        },
        "expected_result": {
          "type": "string",
          "minLength": 1
        },
        "failure_or_edge_cases": {
          "$ref": "#/$defs/string_list"
        }
      }
    },
    "completion_rubric": {
      "type": "object",
      "additionalProperties": false,
      "required": [
        "question_fulfillment",
        "functional_completeness",
        "scenario_flow_coverage",
        "edge_case_handling",
        "regression_safety",
        "verification_completeness"
      ],
      "properties": {
        "question_fulfillment": {
          "type": "integer",
          "minimum": 0,
          "maximum": 100
        },
        "functional_completeness": {
          "type": "integer",
          "minimum": 0,
          "maximum": 100
        },
        "scenario_flow_coverage": {
          "type": "integer",
          "minimum": 0,
          "maximum": 100
        },
        "edge_case_handling": {
          "type": "integer",
          "minimum": 0,
          "maximum": 100
        },
        "regression_safety": {
          "type": "integer",
          "minimum": 0,
          "maximum": 100
        },
        "verification_completeness": {
          "type": "integer",
          "minimum": 0,
          "maximum": 100
        }
      }
    },
    "verification_matrix": {
      "type": "object",
      "additionalProperties": false,
      "required": [
        "build",
        "lint",
        "test",
        "run",
        "behavior_check"
      ],
      "properties": {
        "build": {
          "$ref": "#/$defs/verification_item"
        },
        "lint": {
          "$ref": "#/$defs/verification_item"
        },
        "test": {
          "$ref": "#/$defs/verification_item"
        },
        "run": {
          "$ref": "#/$defs/verification_item"
        },
        "behavior_check": {
          "$ref": "#/$defs/verification_item"
        }
      }
    },
    "product_brief": {
      "type": "object",
      "additionalProperties": false,
      "required": [
        "target_users",
        "core_problem",
        "primary_workflows",
        "domain_assumptions",
        "content_data_model_assumptions",
        "non_goals"
      ],
      "properties": {
        "target_users": {
          "$ref": "#/$defs/string_list_nonempty"
        },
        "core_problem": {
          "type": "string",
          "minLength": 1
        },
        "primary_workflows": {
          "$ref": "#/$defs/string_list_nonempty"
        },
        "domain_assumptions": {
          "$ref": "#/$defs/string_list_nonempty"
        },
        "content_data_model_assumptions": {
          "$ref": "#/$defs/string_list"
        },
        "non_goals": {
          "$ref": "#/$defs/string_list_nonempty"
        }
      }
    },
    "app_quality_gates": {
      "type": "object",
      "additionalProperties": false,
      "required": [
        "ux_workflow_completeness",
        "visual_polish",
        "responsive_desktop_mobile",
        "accessibility_basics",
        "error_loading_empty_states",
        "text_overlap_layout_stability",
        "domain_fit",
        "evidence_requirements"
      ],
      "properties": {
        "ux_workflow_completeness": {
          "$ref": "#/$defs/string_list_nonempty"
        },
        "visual_polish": {
          "$ref": "#/$defs/string_list_nonempty"
        },
        "responsive_desktop_mobile": {
          "$ref": "#/$defs/string_list_nonempty"
        },
        "accessibility_basics": {
          "$ref": "#/$defs/string_list_nonempty"
        },
        "error_loading_empty_states": {
          "$ref": "#/$defs/string_list_nonempty"
        },
        "text_overlap_layout_stability": {
          "$ref": "#/$defs/string_list_nonempty"
        },
        "domain_fit": {
          "$ref": "#/$defs/string_list_nonempty"
        },
        "evidence_requirements": {
          "$ref": "#/$defs/string_list_nonempty"
        }
      }
    },
    "game_brief": {
      "type": "object",
      "additionalProperties": false,
      "required": [
        "target_player",
        "genre",
        "core_loop",
        "mechanics",
        "rules",
        "controls",
        "states",
        "win_lose_restart",
        "difficulty_progression",
        "scoring",
        "feedback",
        "assets",
        "engine_constraints"
      ],
      "properties": {
        "target_player": {
          "$ref": "#/$defs/string_list_nonempty"
        },
        "genre": {
          "type": "string",
          "minLength": 1
        },
        "core_loop": {
          "type": "string",
          "minLength": 1
        },
        "mechanics": {
          "$ref": "#/$defs/string_list_nonempty"
        },
        "rules": {
          "$ref": "#/$defs/string_list_nonempty"
        },
        "controls": {
          "$ref": "#/$defs/string_list_nonempty"
        },
        "states": {
          "$ref": "#/$defs/string_list_nonempty"
        },
        "win_lose_restart": {
          "$ref": "#/$defs/string_list_nonempty"
        },
        "difficulty_progression": {
          "$ref": "#/$defs/string_list_nonempty"
        },
        "scoring": {
          "$ref": "#/$defs/string_list_nonempty"
        },
        "feedback": {
          "$ref": "#/$defs/string_list_nonempty"
        },
        "assets": {
          "$ref": "#/$defs/string_list"
        },
        "engine_constraints": {
          "$ref": "#/$defs/string_list_nonempty"
        }
      }
    },
    "verification_item": {
      "oneOf": [
        {
          "type": "string",
          "minLength": 1
        },
        {
          "type": "object",
          "additionalProperties": false,
          "required": [
            "method",
            "success_condition"
          ],
          "properties": {
            "method": {
              "type": "string",
              "minLength": 1
            },
            "command": {
              "type": "string",
              "minLength": 1
            },
            "success_condition": {
              "type": "string",
              "minLength": 1
            }
          }
        }
      ]
    },
    "iteration_policy_object": {
      "type": "object",
      "additionalProperties": false,
      "required": [
        "threshold_rule",
        "rework_rule",
        "stop_conditions"
      ],
      "properties": {
        "threshold_rule": {
          "type": "string",
          "minLength": 1
        },
        "rework_rule": {
          "type": "string",
          "minLength": 1
        },
        "stop_conditions": {
          "$ref": "#/$defs/string_list_nonempty"
        }
      }
    },
    "iteration_budget": {
      "type": "object",
      "additionalProperties": false,
      "required": [
        "max_iterations",
        "max_rework_iterations",
        "default_consensus_rounds",
        "max_consensus_rounds",
        "max_subagents_per_task",
        "max_open_subagents",
        "max_validation_failures",
        "max_wall_clock_minutes",
        "min_completion_score"
      ],
      "properties": {
        "max_iterations": {
          "type": "integer",
          "minimum": 1,
          "default": 8
        },
        "max_rework_iterations": {
          "type": "integer",
          "minimum": 0,
          "default": 6
        },
        "default_consensus_rounds": {
          "type": "integer",
          "minimum": 0,
          "maximum": 3,
          "default": 2
        },
        "max_consensus_rounds": {
          "type": "integer",
          "minimum": 0,
          "maximum": 3,
          "default": 3
        },
        "max_subagents_per_task": {
          "type": "integer",
          "minimum": 1,
          "default": 16
        },
        "max_open_subagents": {
          "type": "integer",
          "minimum": 1,
          "default": 6
        },
        "max_validation_failures": {
          "type": "integer",
          "minimum": 0,
          "default": 3
        },
        "max_wall_clock_minutes": {
          "type": "integer",
          "minimum": 1,
          "default": 180
        },
        "min_completion_score": {
          "type": "integer",
          "minimum": 85,
          "maximum": 100,
          "default": 85
        }
      }
    },
    "security_policy": {
      "type": "object",
      "additionalProperties": false,
      "required": [
        "allowed_files_required",
        "path_normalization_required",
        "symlink_escape_rejected",
        "secret_scan_required",
        "scope_diff_required",
        "unauthorized_network_or_cost_rejected"
      ],
      "properties": {
        "allowed_files_required": {
          "type": "boolean",
          "const": true
        },
        "path_normalization_required": {
          "type": "boolean",
          "const": true
        },
        "symlink_escape_rejected": {
          "type": "boolean",
          "const": true
        },
        "secret_scan_required": {
          "type": "boolean",
          "const": true
        },
        "scope_diff_required": {
          "type": "boolean",
          "const": true
        },
        "unauthorized_network_or_cost_rejected": {
          "type": "boolean",
          "const": true
        }
      }
    },
    "delegation_seed": {
      "type": "object",
      "additionalProperties": false,
      "required": [
        "task_id",
        "objective",
        "owner"
      ],
      "properties": {
        "task_id": {
          "type": "string",
          "minLength": 1
        },
        "objective": {
          "type": "string",
          "minLength": 1
        },
        "owner": {
          "enum": [
            "goal_refiner",
            "goal_review_worker",
            "explorer_agent",
            "app_designer",
            "frontend_worker",
            "game_designer",
            "game_engine_worker",
            "asset_worker",
            "game_asset_worker",
            "playtest_worker",
            "polish_reviewer",
            "subtask_worker",
            "review_worker",
            "verification_worker",
            "summary_worker",
            "security_agent",
            "technical_agent",
            "management_agent"
          ]
        },
        "allowed_files": {
          "type": "array",
          "items": {
            "$ref": "#/$defs/safe_relative_path"
          }
        }
      }
    },
    "safe_relative_path": {
      "type": "string",
      "minLength": 1,
      "allOf": [
        {
          "not": {
            "pattern": "(^|[\\\\/])\\.\\.([\\\\/]|$)"
          }
        },
        {
          "not": {
            "pattern": "(^|[\\\\/])\\.([\\\\/]|$)"
          }
        },
        {
          "not": {
            "pattern": "^[A-Za-z]:"
          }
        },
        {
          "not": {
            "pattern": "^[\\\\/]"
          }
        },
        {
          "not": {
            "pattern": "^~"
          }
        },
        {
          "not": {
            "pattern": "%[A-Za-z_][A-Za-z0-9_]*%"
          }
        },
        {
          "not": {
            "pattern": "\\$\\{?(env:)?[A-Za-z_][A-Za-z0-9_]*\\}?"
          }
        },
        {
          "not": {
            "pattern": "[*?\\[\\]]"
          }
        }
      ]
    }
  }
}
